{
  "irVersion": "0.2",
  "language": "0.1",
  "agent": "conformance.structured.Structured",
  "doc": "A schema-constrained answer, read back through a field.",
  "inputs": {
    "topic": "string"
  },
  "outputs": {
    "report": "artifact<markdown>"
  },
  "types": {
    "draft": {
      "fields": [
        {
          "name": "body",
          "type": "markdown"
        },
        {
          "name": "sources",
          "type": "source[]"
        }
      ]
    },
    "source": {
      "fields": [
        {
          "name": "url",
          "type": "string"
        },
        {
          "name": "title",
          "type": "string"
        }
      ]
    }
  },
  "requirements": {
    "model": {
      "mode": "capabilities",
      "capabilities": [
        "structured_output"
      ]
    }
  },
  "budget": {
    "steps": 2
  },
  "policy": {
    "network": {
      "decision": "deny"
    }
  },
  "effects": [
    "model_access"
  ],
  "entry": "n0",
  "nodes": [
    {
      "id": "n0",
      "kind": "llm.call",
      "sourceSpan": {
        "source": "main.ing",
        "start": 453,
        "end": 510
      },
      "binding": "found",
      "prompt": {
        "kind": "template",
        "parts": [
          {
            "kind": "text",
            "value": "Write about "
          },
          {
            "kind": "value",
            "value": {
              "kind": "ref",
              "scope": "input",
              "path": [
                "topic"
              ]
            },
            "type": "string"
          },
          {
            "kind": "text",
            "value": " and cite your sources."
          }
        ]
      },
      "responseType": "draft",
      "effects": [
        "model_access"
      ],
      "next": "n1"
    },
    {
      "id": "n1",
      "kind": "artifact.emit",
      "sourceSpan": {
        "source": "main.ing",
        "start": 515,
        "end": 539
      },
      "value": {
        "kind": "ref",
        "scope": "binding",
        "path": [
          "found",
          "body"
        ]
      },
      "output": "report",
      "next": null
    }
  ]
}
