{
  "irVersion": "0.2",
  "language": "0.1",
  "agent": "conformance.repeated.Repeated",
  "doc": "A bounded loop whose guard stops it before the bound.\n\n`max` is the static bound the compiler enforces; the guard is what usually\nends the loop first. Both matter, and a backend that honoured only one would\npass a case that tested only the other.",
  "inputs": {
    "topic": "string"
  },
  "outputs": {
    "notes": "artifact<markdown>"
  },
  "types": {
    "verdict": {
      "fields": [
        {
          "name": "text",
          "type": "markdown"
        },
        {
          "name": "good_enough",
          "type": "bool"
        }
      ]
    }
  },
  "requirements": {
    "model": {
      "mode": "capabilities",
      "capabilities": [
        "structured_output"
      ]
    }
  },
  "state": {
    "done": "bool",
    "draft": "markdown"
  },
  "budget": {
    "steps": 4
  },
  "policy": {
    "network": {
      "decision": "deny"
    }
  },
  "effects": [
    "model_access"
  ],
  "entry": "n0",
  "nodes": [
    {
      "id": "n0",
      "kind": "llm.call",
      "sourceSpan": {
        "source": "main.ing",
        "start": 616,
        "end": 663
      },
      "binding": "$tmp0",
      "prompt": {
        "kind": "template",
        "parts": [
          {
            "kind": "text",
            "value": "Write one line about "
          },
          {
            "kind": "value",
            "value": {
              "kind": "ref",
              "scope": "input",
              "path": [
                "topic"
              ]
            },
            "type": "string"
          },
          {
            "kind": "text",
            "value": "."
          }
        ]
      },
      "responseType": "markdown",
      "effects": [
        "model_access"
      ],
      "next": "n1"
    },
    {
      "id": "n1",
      "kind": "state.write",
      "sourceSpan": {
        "source": "main.ing",
        "start": 602,
        "end": 663
      },
      "field": "draft",
      "value": {
        "kind": "ref",
        "scope": "binding",
        "path": [
          "$tmp0"
        ]
      },
      "next": "n2"
    },
    {
      "id": "n2",
      "kind": "state.write",
      "sourceSpan": {
        "source": "main.ing",
        "start": 668,
        "end": 686
      },
      "field": "done",
      "value": {
        "kind": "literal",
        "type": "bool",
        "value": false
      },
      "next": "n3"
    },
    {
      "id": "n3",
      "kind": "state.read",
      "sourceSpan": {
        "source": "main.ing",
        "start": 709,
        "end": 719
      },
      "binding": "$state.done",
      "field": "done",
      "next": "n4"
    },
    {
      "id": "n4",
      "kind": "loop",
      "sourceSpan": {
        "source": "main.ing",
        "start": 691,
        "end": 876
      },
      "body": "n5",
      "maxIterations": 4,
      "guard": {
        "kind": "unary",
        "op": "!",
        "operand": {
          "kind": "ref",
          "scope": "binding",
          "path": [
            "$state.done"
          ]
        }
      },
      "next": "n9"
    },
    {
      "id": "n5",
      "kind": "llm.call",
      "sourceSpan": {
        "source": "main.ing",
        "start": 737,
        "end": 800
      },
      "binding": "graded",
      "prompt": {
        "kind": "literal",
        "type": "string",
        "value": "Improve this and say whether it is good enough."
      },
      "responseType": "verdict",
      "effects": [
        "model_access"
      ],
      "next": "n6"
    },
    {
      "id": "n6",
      "kind": "state.write",
      "sourceSpan": {
        "source": "main.ing",
        "start": 807,
        "end": 832
      },
      "field": "draft",
      "value": {
        "kind": "ref",
        "scope": "binding",
        "path": [
          "graded",
          "text"
        ]
      },
      "next": "n7"
    },
    {
      "id": "n7",
      "kind": "state.write",
      "sourceSpan": {
        "source": "main.ing",
        "start": 839,
        "end": 870
      },
      "field": "done",
      "value": {
        "kind": "ref",
        "scope": "binding",
        "path": [
          "graded",
          "good_enough"
        ]
      },
      "next": "n8"
    },
    {
      "id": "n8",
      "kind": "state.read",
      "sourceSpan": {
        "source": "main.ing",
        "start": 691,
        "end": 876
      },
      "binding": "$state.done",
      "field": "done",
      "next": null
    },
    {
      "id": "n9",
      "kind": "state.read",
      "sourceSpan": {
        "source": "main.ing",
        "start": 894,
        "end": 905
      },
      "binding": "$state.draft",
      "field": "draft",
      "next": "n10"
    },
    {
      "id": "n10",
      "kind": "artifact.emit",
      "sourceSpan": {
        "source": "main.ing",
        "start": 881,
        "end": 905
      },
      "value": {
        "kind": "ref",
        "scope": "binding",
        "path": [
          "$state.draft"
        ]
      },
      "output": "notes",
      "next": null
    }
  ]
}
